{
  "schema": "genii.persona.run/3",
  "kit": "persona-quiz-v2@2026-09-30/2026-09-26/v2-2026-09-26",
  "runId": "contract01",
  "createdAt": "2026-09-30T09:00:00.000Z",
  "updatedAt": "2026-09-30T09:20:00.000Z",
  "setup": {
    "closest": "best_friend",
    "pronoun": "they"
  },
  "lobby": {
    "voice": "fun",
    "depth": "anything",
    "rooms": [
      "love",
      "work",
      "family"
    ]
  },
  "answers": {
    "C1-140": 2,
    "C1-125": 3,
    "C1-131": 0,
    "C1-143": [
      5
    ],
    "C1-147": [
      0,
      1
    ],
    "C1-141": 0,
    "C1-127": 3,
    "C1-124": 0,
    "C1-163": 3,
    "C1-144": 0,
    "C2-160": 2,
    "C2-50": 0,
    "C2-125": 0,
    "C2-126": 1,
    "C2-144": 1,
    "C2-161": 0,
    "C2-146": [
      0,
      2
    ],
    "C2-141": "not_my_life",
    "C3-91": 0,
    "C3-162": 0,
    "C3-147": 0,
    "C3-161": 2,
    "C4-5": 0,
    "C4-161": 3,
    "C4-123": 2,
    "C4-143": 0,
    "C4-124": 0,
    "C4-127": 1,
    "C5-141": 0,
    "C5-129": 2,
    "C5-51": 0,
    "C6-140": "not_my_life",
    "C6-148": [
      4
    ],
    "C6-91": 0,
    "C6-143": 1,
    "C6-127": 3,
    "C7-112": 0,
    "C7-140": "skip",
    "C7-160": 3,
    "C7-111": 0
  },
  "ms": {
    "C1-140": 7663,
    "C1-125": 8340,
    "C1-131": 3670,
    "C1-143": 8358,
    "C1-147": 5622,
    "C1-141": 1053,
    "C1-127": 2953,
    "C1-124": 3391,
    "C1-163": 6254,
    "C1-144": 7867,
    "C2-160": 6514,
    "C2-50": 4295,
    "C2-125": 5890,
    "C2-126": 7417,
    "C2-144": 6612,
    "C2-161": 949,
    "C2-146": 3001,
    "C2-141": 6748,
    "C3-91": 8409,
    "C3-162": 5800,
    "C3-147": 6719,
    "C3-161": 6603,
    "C4-5": 4739,
    "C4-161": 7037,
    "C4-123": 3155,
    "C4-143": 3898,
    "C4-124": 4632,
    "C4-127": 4770,
    "C5-141": 7336,
    "C5-129": 8081,
    "C5-51": 6589,
    "C6-140": 5145,
    "C6-148": 5321,
    "C6-91": 6580,
    "C6-143": 7132,
    "C6-127": 8463,
    "C7-112": 7386,
    "C7-140": 7602,
    "C7-160": 5716,
    "C7-111": 4526
  },
  "frozen": {
    "version": "persona-quiz-v2",
    "predictions": [
      {
        "id": "S-160",
        "primary": "L3",
        "pass": false,
        "why": null,
        "predicted": 0,
        "predictedText": "Out. The rule doesn't check who's oldest.",
        "side": 1,
        "scores": [
          1.12,
          -1.12,
          0.36,
          -0.56
        ]
      },
      {
        "id": "S-120",
        "primary": "R1",
        "pass": false,
        "why": null,
        "predicted": 0,
        "predictedText": "Yes, and we sail it together, every weekend.",
        "side": 1,
        "scores": [
          0.5,
          -0.5,
          -0.25,
          0.25
        ]
      },
      {
        "id": "S-130",
        "primary": "L1",
        "pass": false,
        "why": null,
        "predicted": 1,
        "predictedText": "Keep the job. Cook for friends on weekends, happily.",
        "side": 1,
        "scores": [
          -0.8423,
          0.8423,
          0.392,
          -0.392
        ]
      },
      {
        "id": "S-126",
        "primary": "R2",
        "pass": false,
        "why": null,
        "predicted": 0,
        "predictedText": "Screenshot, then call my best friend tonight.",
        "side": 1,
        "scores": [
          1.12,
          -0.56,
          -1.12,
          0.41
        ]
      },
      {
        "id": "S-134",
        "primary": "L2",
        "pass": false,
        "why": null,
        "predicted": 0,
        "predictedText": "Count tiles nightly. Post the percentage somewhere public.",
        "side": 1,
        "scores": [
          1.185,
          -1.185,
          0.5925,
          -0.5925
        ]
      },
      {
        "id": "S-111",
        "primary": "R3",
        "pass": false,
        "why": null,
        "predicted": 0,
        "predictedText": "Accept before the call. Join it to share the news.",
        "side": -1,
        "scores": [
          1,
          -1,
          0.5,
          -0.5
        ]
      },
      {
        "id": "S-121",
        "primary": "R1",
        "pass": false,
        "why": null,
        "predicted": 0,
        "predictedText": "Call them mid-drizzle. I'd have told them anyway.",
        "side": 1,
        "scores": [
          0.7,
          -0.7,
          -0.25,
          0.25
        ]
      },
      {
        "id": "S-142",
        "primary": "L2",
        "pass": false,
        "why": null,
        "predicted": 0,
        "predictedText": "Every evening, by headlamp if I have to. That photo's mine.",
        "side": 1,
        "scores": [
          1.285,
          -1.285,
          0.6425,
          -0.6425
        ]
      }
    ],
    "frozenAt": "2026-09-30T09:00:43.000Z",
    "profileSha256": "c3c6e72ff29984d6d8ac67d4ed8c1542287cbd366fb32b2a1779dc574ed51c7d"
  },
  "lockHash": "790c61ffa269df1c703d424da1d5a1a70cbd2295370fcc8e031ce4c450513ebd",
  "finale": {
    "S-160": 0,
    "S-120": 0,
    "S-130": 1,
    "S-126": 0,
    "S-134": 0,
    "S-111": 0,
    "S-121": 0,
    "S-142": 0
  },
  "challenges": [
    {
      "id": "example01",
      "rel": "bestie",
      "love": true,
      "mk": false,
      "stings": true,
      "showType": true,
      "emoji": 0,
      "invite": 0,
      "name": "Sam",
      "seed": 424242,
      "createdAt": "2026-09-30T09:05:00.000Z",
      "sentBefore": false
    }
  ],
  "friendResults": [
    {
      "challengeId": "example01",
      "receivedAt": "2026-09-30T09:20:00.000Z",
      "guesses": {
        "level1": {
          "R1": -1,
          "R2": 1,
          "R3": -1,
          "L1": 1,
          "L2": -1,
          "L3": 1
        },
        "level2": {
          "C1-140": "a",
          "C4-5": "a",
          "C1-144": "a",
          "C6-127": "a",
          "C1-131": "a",
          "C2-50": "a",
          "C4-143": "a",
          "C3-147": "a",
          "C1-163": "a",
          "C5-129": "a",
          "C4-124": "a",
          "C1-125": "a"
        },
        "why": {
          "C1-140": "seen",
          "C4-5": "seen",
          "C6-127": "seen",
          "C4-143": "seen"
        },
        "level3": [
          "T19B",
          "T03B",
          "T03A",
          "T02A"
        ],
        "level4": {
          "sting": "T09A",
          "roast": "R03"
        }
      },
      "hideRoast": false
    }
  ],
  "returnTo": null
}
